[
  {
    "fullName": "Franklin Delano Roosevelt",
    "aliases": [
      "FDR",
      "Franklin Roosevelt"
    ],
    "birthDate": "1882-01-30",
    "deathDate": "1945-04-12",
    "nationality": "US",
    "politicalAffiliation": "Democratic Party",
    "role": "Head of State",
    "majorContributions": [
      "New Deal policies to combat the Great Depression",
      "Leadership during World War II",
      "Social Security Act",
      "Established a welfare state in the US",
      "Fought for civil rights"
    ],
    "associatedEvents": [
      {
        "eventName": "Stock Market Crash of 1929",
        "date": "1929-10-29",
        "location": "New York City, USA",
        "description": "The Wall Street crash marked the beginning of the Great Depression, greatly impacting the US economy."
      }
    ],
    "publicPerception": "Revered",
    "personalThoughts": [
      {
        "date": "1933-03-04",
        "context": "Inaugural Address",
        "entry": "The only thing we have to fear is fear itself."
      }
    ],
    "quotes": [
      "The only thing we have to fear is fear itself.",
      "We have nothing to fear but fear itself.",
      "I pledge you, I pledge myself, to a new deal for the American people."
    ],
    "legacy": "World-changing"
  },
  {
    "fullName": "Herbert Hoover",
    "aliases": [
      "The Great Engineer"
    ],
    "birthDate": "1874-08-10",
    "deathDate": "1964-10-20",
    "nationality": "US",
    "politicalAffiliation": "Republican Party",
    "role": "Head of State",
    "majorContributions": [
      "Served as the 31st President of the United States during the onset of the Great Depression.",
      "Led humanitarian efforts in Europe during and after World War I.",
      "Secretary of Commerce during the Harding and Coolidge administrations."
    ],
    "associatedEvents": [
      {
        "eventName": "World War I Relief Efforts",
        "startDate": "1914-01-01",
        "endDate": "1918-11-11",
        "description": "Organized and led efforts to provide food and aid to war-torn Europe."
      },
      {
        "eventName": "Great Mississippi Flood of 1927",
        "startDate": "1927-04-01",
        "endDate": "1927-06-01",
        "description": "Led relief efforts as Secretary of Commerce during the devastating Mississippi River flood."
      }
    ],
    "publicPerception": "Controversial",
    "personalThoughts": [
      {
        "date": "1929-03-04",
        "context": "Inaugural Address",
        "entry": "I have no fears for the future of our country. It is bright with hope."
      }
    ],
    "quotes": [
      "American individualism is the primary source of our liberties.",
      "Blessed are the young for they shall inherit the national debt."
    ],
    "legacy": "Significant"
  },
  {
    "fullName": "Huey Long",
    "aliases": [
      "The Kingfish"
    ],
    "birthDate": "1893-08-30",
    "deathDate": "1935-09-10",
    "nationality": "US",
    "politicalAffiliation": "Democratic Party",
    "role": "Revolutionary",
    "majorContributions": [
      "Share Our Wealth program",
      "Infrastructure development in Louisiana",
      "Populist rhetoric and policies"
    ],
    "associatedEvents": [
      {
        "eventName": "Louisiana Gubernatorial Election",
        "date": "1928-01-01",
        "location": "Louisiana, USA",
        "description": "Huey Long is elected Governor of Louisiana."
      }
    ],
    "publicPerception": "Controversial",
    "personalThoughts": [
      {
        "date": "1930-01-15",
        "context": "Addressing the Louisiana State Legislature",
        "entry": "Every man a king, but no one wears a crown."
      }
    ],
    "quotes": [
      "Every man a king.",
      "I'm for the poor man - all poor men. Poor men, rich men, all colors, all creeds, all sections. That's who I'm after.",
      "When I talk to the rich folks, I talk to them out of one side of my mouth. But when I talk to the poor folks, I talk to them with both sides."
    ],
    "legacy": "Significant"
  },
  {
    "fullName": "Al Capone",
    "aliases": [
      "Scarface"
    ],
    "birthDate": "1899-01-17",
    "deathDate": "1947-01-25",
    "nationality": "US",
    "politicalAffiliation": "None",
    "role": "Business Leader",
    "majorContributions": [
      "Organized crime syndicate leadership",
      "Bootlegging during Prohibition",
      "Tax evasion"
    ],
    "associatedEvents": [
      {
        "eventName": "Saint Valentine's Day Massacre",
        "date": "1929-02-14",
        "location": "Chicago, Illinois",
        "description": "The assassination of seven members of the North Side Gang during the Prohibition Era."
      }
    ],
    "publicPerception": "Feared",
    "personalThoughts": [
      {
        "date": "1924-05-10",
        "context": "Reflecting on his business ventures",
        "entry": "I'm just a businessman, giving the people what they want."
      }
    ],
    "quotes": [
      "I have spent the best years of my life giving people the lighter pleasures, helping them have a good time, and all I get is abuse, the existence of a hunted man.",
      "Don't mistake my kindness for weakness. I am kind to everyone, but if someone is unkind to me, weak is not what you are going to remember about me."
    ],
    "legacy": "Significant"
  },
  {
    "fullName": "Charles Curtis",
    "aliases": [
      "Indian Charlie"
    ],
    "birthDate": "1860-01-25",
    "deathDate": "1936-02-08",
    "nationality": "US",
    "politicalAffiliation": "Republican",
    "role": "Head of State",
    "majorContributions": [
      "Served as the 31st Vice President of the United States",
      "First Native American to hold such a high office",
      "Instrumental in shaping legislation related to Native American affairs",
      "Served as Senate Majority Leader"
    ],
    "associatedEvents": [
      {
        "eventName": "Dawes Act",
        "date": "1887-02-08",
        "description": "Curtis, despite being of Native American heritage, actively participated in the implementation of the Dawes Act, which aimed to assimilate Native Americans into mainstream society by dividing tribal lands into individual allotments."
      },
      {
        "eventName": "Curtis Act",
        "date": "1898-06-28",
        "description": "Curtis sponsored the Curtis Act, which further eroded tribal sovereignty and paved the way for the dissolution of tribal governments in Indian Territory (now Oklahoma)."
      }
    ],
    "publicPerception": "Respected",
    "personalThoughts": [
      {
        "date": "1929-03-04",
        "context": "Inauguration as Vice President",
        "entry": "I am honored to serve the nation as Vice President and hope to serve with diligence and integrity."
      }
    ],
    "quotes": [
      "I am an Indian, and proud of it.",
      "The Republican party is the party of progress and prosperity."
    ],
    "legacy": "Significant"
  },
  {
    "fullName": "Henry Ford",
    "aliases": [
      "HF"
    ],
    "birthDate": "1863-07-30",
    "deathDate": "1947-04-07",
    "nationality": "US",
    "politicalAffiliation": "None",
    "role": "Business Leader",
    "majorContributions": [
      "Mass production of automobiles",
      "Assembly line innovation",
      "Affordable car ownership for the masses"
    ],
    "associatedEvents": [
      {
        "eventName": "Founding of the Ford Motor Company",
        "eventDate": "1903-06-16",
        "eventDescription": "Henry Ford establishes the Ford Motor Company, revolutionizing the automobile industry."
      },
      {
        "eventName": "Introduction of the Model T",
        "eventDate": "1908-10-01",
        "eventDescription": "The Ford Model T is introduced, becoming a symbol of affordable transportation for the American public."
      },
      {
        "eventName": "Implementation of the $5 Workday",
        "eventDate": "1914-01-05",
        "eventDescription": "Ford implements the $5 workday, doubling the average factory wage and attracting a large workforce."
      }
    ],
    "publicPerception": "Controversial",
    "personalThoughts": [
      {
        "date": "1922-01-01",
        "context": "Reflecting on his business philosophy",
        "entry": "The key to democratic production is interchangeability. To continue to use one tool when another better adapted to the purpose can be had is a waste of time."
      }
    ],
    "quotes": [
      "Whether you think you can, or you think you can't \u2013 you're right.",
      "Failure is simply the opportunity to begin again, this time more intelligently."
    ],
    "legacy": "World-changing"
  },
  {
    "fullName": "John Nance Garner",
    "aliases": [
      "Cactus Jack"
    ],
    "birthDate": "1868-11-22",
    "deathDate": "1967-11-07",
    "nationality": "US",
    "politicalAffiliation": "Democratic Party",
    "role": "Head of State",
    "majorContributions": [
      "Served as Speaker of the House of Representatives",
      "Served as Vice President of the United States under Franklin D. Roosevelt",
      "Helped shape New Deal legislation in its early stages"
    ],
    "associatedEvents": [
      {
        "eventName": "Spanish-American War",
        "date": "1898",
        "location": "Cuba, Philippines, Guam, Puerto Rico",
        "description": "Garner supported the war effort as a local politician."
      },
      {
        "eventName": "Passage of the Revenue Act of 1913",
        "date": "1913",
        "location": "Washington, D.C.",
        "description": "Garner played a role in shaping the legislation as a member of the House Ways and Means Committee."
      }
    ],
    "publicPerception": "Respected",
    "personalThoughts": [
      {
        "date": "1933-03-04",
        "context": "Inauguration of Franklin D. Roosevelt",
        "entry": "Reflected on the gravity of the economic crisis and the need for bold action."
      }
    ],
    "quotes": [